{
  "session_id": "example-session-001",
  "revision": 2,
  "architecture_version": "1.1",
  "curriculum_id": "ACE-ALGEBRA1",
  "curriculum_version": "1.1.0",
  "mode": "TARGET_ASSESSMENT",
  "entry_route": "TOPIC",
  "target_episode_id": "example-episode-001",
  "original_target_skill_id": "Q07",
  "current_skill_id": "Q07",
  "active_item_id": "example-item-q07-001",
  "active_item_version": 1,
  "return_stack": [],
  "suspended_episode_ids": [],
  "criteria": [],
  "orientation": {
    "presented_count": 0,
    "usable_event_ids": [],
    "recommendation_id": null,
    "provisional_target_skill_id": null
  },
  "budgets": {
    "target_assessment_items": 1,
    "diagnostic_items": 0,
    "instructional_turns": 0,
    "failed_repair_cycles": 0,
    "maximum_minutes": 20
  },
  "pending_operation_id": null,
  "issue": null,
  "created_at": "2026-10-21T02:00:00Z",
  "last_activity_at": "2026-10-21T02:00:10Z",
  "expires_at": "2026-10-22T02:00:10Z",
  "accepted_event_ids": [
    "example-event-select-001"
  ],
  "binding": {
    "provider": "mock",
    "model": "fixture-v1",
    "architecture_sha256": "0000000000000000000000000000000000000000000000000000000000000000",
    "acknowledged": true
  }
}
